article_id,organizations,persons,locations,timestamp,longitude,latitude
20190110194500-326,senate majority whip john thune;american federation of labor;white house;facebook;cnn;world economic forum;warwick business school;european union;volkswagen;ford motor co,susan collins;donald trump;jim gleason;nancy pelosi;cory gardner;kevin liptak;mitch mcconnell;betsy klein;lisa murkowski;ashley killough;steven armstrong;christian stadler,"New York, United States;United States;Davos, Switzerland (General), Switzerland;Washington, Washington, United States;Florida, United States;Mascotte, Florida, United States;Minneola, Florida, United States;Switzerland;Germany;Dearborn, Michigan, United States;Kirka, Afyonkarahisar, Turkey;United Kingdom;Saarlouis, Saarland, Germany;China;Russia;Michigan, United States;London, London, City Of, United Kingdom;Turkey",20190110194500,-74.9384,42.1497
20191006194500-892,houston police;cnn,henry gaw;swetha sharma;john cannon,"Houston, Texas, United States;Texas, United States",20191006194500,-95.3633,29.7633
20191216123000-938,reich main security office,reinhard heydrich;adolf hitler;heinrich himmler,"Germany;Czech Republic;Wannsee, Berlin, Germany;Horst Wessel, Berlin, Germany;Berlin, Berlin, Germany",20191216123000,10.5,51.5
20190625104500-444,democratic national committee;democratic party;cnn,cory booker;elizabeth warren;john hickenlooper;joe biden;ronald reagan;steve bullock;jeff weaver;walter mondale;amy klobuchar;jennifer palmieri;john delaney;julian castro;pete buttigieg;sarah palin;john edwards;tim ryan;hillary clinton;paul ryan;kamala harris;kirsten gillibrand;bernie sanders,"Miami, Florida, United States;Jersey;Montana, United States;United States;South Carolina, United States;Massachusetts, United States;Alaska, United States;Vermont, United States;Colorado, United States;Minnesota, United States;California, United States;Maryland, United States;Wisconsin, United States;Ohio, United States",20190625104500,-80.1937,25.7743
20190409154500-256,twitter;corus entertainment inc;cnn,ariana grande;george dewey;ryan reynolds;david goldberg;caroline baumgard;felicity huffman;karey burke;lana haroun;lana h haroun;tamara qiblawi;omar al-bashir;ahmed awad;suha babikir,"Stockholm, Stockholm, Sweden;Sudan;Khartoum, Al Khartum, Sudan",20190409154500,18.05,59.3333
20191126183000-1665,white house;office of management;house budget committee;cnn,michael duffey;donald trump;mark sandy;volodymyr zelensky,"White House, District Of Columbia, United States;Ukraine",20191126183000,-77.0364,38.8951
20190523194500-51,cnn;department of natural resources;michigan department of health;human services,,"Turkey;Michigan, United States",20190523194500,34.911546,39.059012
20190927013000-1453,college park;doctors at atlanta medical center,jerrontae cain,"Georgia, United States;College Park, Georgia, United States;Fulton County, Georgia, United States;Atlanta, Georgia, United States",20190927013000,-83.6487,32.9866
20190425134500-2153,un office for disaster risk reduction;international federation of red cross;twitter;department of civil protection mr nathan nkomo;reuters,mami mizutori;nick miller,"Tanzania;Michigan, United States;Mozambique;Mtwara, Mtwara, Tanzania;Zimbabwe;Comoros",20190425134500,35.0,-6.0
20190411161500-1298,cnn,robert zoldos;dianne gallagher;chris iannuzzi;paul p murphy;eliott c mclaughlin,"North Carolina, United States",20190411161500,-79.8431,35.6411
20190211151500-105,senate appropriations committee;department of homeland security;senate republicans;white house;cnn,lucille roybal-allard;donald trump;mick mulvaney;richard shelby,"El Paso, Texas, United States;Capitol Hill, District Of Columbia, United States;Texas, United States;White House, District Of Columbia, United States",20190211151500,-106.48700000000001,31.7587
20191115234500-1514,citigroup;reuters,,China;Hong Kong;Singapore,20191115234500,105.0,35.0
20190409060000-1651,victoria police,,Australia;New Zealand,20190409060000,135.0,-25.0
20190225181500-1622,international bureau of aviation;british airways;cnn,phil seymour;richard whalley,"Gibraltar;United Kingdom;Heathrow, Hillingdon, United Kingdom;Spain",20190225181500,-5.35,36.133333
20191010204500-339,trump international hotel;election commission;cnn;dulles international airport,igor fruman;michael warren;joe biden;erica orden;david correia;lev parnas;david shortell;rudy giuliani;andrey kukushkin;evan perez,"Germany;New York, United States;Canada;Virginia, United States;Manhattan, New York, United States;Washington, Washington, United States;Ukraine",20191010204500,10.5,51.5
20191205050000-896,brexit party,theresa may;nigel farage;victor farrell;louis stedman-bryce;brian taylor;stuart waiton;boris johnson,"United Kingdom;Glenrothes, Fife, United Kingdom",20191205050000,-4.0,54.0
20190117123000-1143,white house national security council;u s army europe;white house;trump administration;navy seal admiral william mcraven;cnn;defense department,mark hertling;donald trump;mark milley;joseph dunford;barack obama;jim mattis;sarah sanders;john kelly;patrick shanahan;stanley mcchrystal,"Germany;Afghanistan;Manbij, ?Alab, Syria;Iraq;United States;Iran;White House, District Of Columbia, United States;Tehran, Tehran, Iran;Syria",20190117123000,10.5,51.5
20190718101500-879,voter education fund;democrats in congress;american banking association;senate banking;cnn,rob engstrom;jon tester;donald trump;sherrod brown;rob nichols;ted budd,"Montana, United States;Ohio, United States;United States;North Carolina, United States;Washington, Washington, United States",20190718101500,-110.32600000000001,46.9048
20190415211500-1052,cnn,donald trump,"United States;Massachusetts, United States",20190415211500,-98.5795,39.828175
20190424000000-1005,israel defense forces;cnn,ali al-badan;osama al-badan,"Tuqu, West Bank (General), West Bank;Beit Jala, West Bank (General), West Bank;Israel;West Bank",20190424000000,35.2174,31.6373
20191217191500-2152,senate on;white house;cnn;senate armed services;united states,jim inhofe;justin amash;donald trump,"China;Oklahoma, United States;United States;White House, District Of Columbia, United States;Russia",20191217191500,105.0,35.0
20191118163000-1575,iranian foreign ministry spokesman abbas mousavi;white house;cnn;reuters,hassan nasrallah;donald trump;mike pompeo;abdolreza rahmani fazli;ali khamenei,"Isfahan, Esfahan, Iran;Iraq;Iran;Washington, Washington, United States;Lebanon;Tehran, Tehran, Iran",20191118163000,51.6714,32.6597
20190524180000-1213,nijmegen company grenadier;cnn;united states,theresa may;donald trump;archie harrison;prince harry,"Cambridge, Cambridgeshire, United Kingdom;United States;Sussex, East Sussex, United Kingdom;United Kingdom;Spain;London, London, City Of, United Kingdom;Buckingham Palace, Westminster, United Kingdom",20190524180000,0.116667,52.2
20190319071500-1818,international federation of red cross;zimbabwe information ministry;st charles lwanga school;twitter;ministry of information;zimbabwe ministry of information;cnn,cylone idai;filipe nyusi;jamie lesueur;emmerson mnangagwa;vasco cotovio;bukola adebayo;indian ocean;brandon miller;columbus s mavhunga,"Lagos, Lagos, Nigeria;Michigan, United States;Salisbury, Mashonaland East, Zimbabwe;Zimbabwe;Portugal;Mozambique;Chipinge, Manicaland, Zimbabwe;Beira, Sofala, Mozambique;London, London, City Of, United Kingdom;Chimanimani District, Zimbabwe (General), Zimbabwe",20190319071500,3.39583,6.45306
20190702210000-1333,boeing;american airlines,,"New York, United States;Phoenix, Arizona, United States;United States;Dallas, Texas, United States;Fort Worth, Texas, United States;Oakland, California, United States;San Francisco, California, United States",20190702210000,-74.9384,42.1497
20191112040000-1057,us congress;cnn,donald trump;vladimir putin;tayyip erdogan,"Syria;United States;Russia;White House, District Of Columbia, United States;Turkey",20191112040000,38.0,35.0
20190715114500-1535,youtube;twitter;facebook;world wrestling entertainment,crown jewel;sean paul;enrique iglesias;jason derulo;nicki minaj;mariah carey;david guetta,"Saudi Arabia;Riyad, Ar Riya?, Saudi Arabia;Jeddah, Makkah, Saudi Arabia;Kansas, United States",20190715114500,45.0,25.0
20190504151500-945,centers for disease;texa austin public health department;cnn,le parisien,"Paris, France (General), France;France",20190504151500,2.33333,48.8667
20190127110000-313,alaska department of fish;us forest service;cnn,keith allen;andrew renner;owen renner;aaron peterson;ursula perano;amanda watts,"Alaska, United States",20190127110000,-152.268,61.385
20190920041500-931,,abu dhabi;khaled khayat;mahmoud khayat;tareq khayat;amer khayat,"Beirut, Beyrouth, Lebanon;Australia;Iraq;Sydney, New South Wales, Australia;Turkey;Lebanon",20190920041500,35.5097,33.8719
20200107211500-2632,oil prices;white house;oval office;white house correspondent association,jon karl;stephanie grisham;qasem soleimani,"New York, United States;Saudi Arabia;Iran;Washington, Washington, United States",20200107211500,-74.9384,42.1497
20191126033000-1139,victoria police sergeant danny brown;cnn,aslan king,"Australia;United Kingdom;Princeton, Devon, United Kingdom",20191126033000,135.0,-25.0
20190624171500-255,eurofighter;twitter;team luftwaffe;cnn,,"Germany;Neubrandenburg, Mecklenburg-Vorpommern, Germany;Jabel, Niedersachsen, Germany;Silz, Mecklenburg-Vorpommern, Germany",20190624171500,10.5,51.5
20191217231500-1506,republican party;white house;senate minority leader chuck schumer;house rules committee;cnn;oval office;united states;house intelligence committee;european union;senate majority leader mitch mcconnell,lucy mcbath;angerer getty;daniel dale;andy kim;nancy pelosi;joe biden;elissa slotkin;jeff van drew;susie lee;adam schiff;collin peterson;betsy klein;abby finkenauer;tom ohalleran;sean patrick maloney;bill clinton;norma torres;ted barrett;mikie sherrill;marie yovanovitch;anthony brindisi;antonio delgado;dave loebsack;matt cartwright;ben mcadams;jamie raskin;max rose;angie craig;cheri bustos;joe cunningham;bill taylor;kylie atwood;cindy axne;chris pappas;josh gottheimer;volodymyr zelensky;ali zaslav;mitch mcconnell;kendra horn;doug collins;jim acosta;tom cole;gordon sondland;lauren underwood,"Canada;United States;Guatemala;White House, District Of Columbia, United States;Ukraine;Kentucky, United States",20191217231500,-96.0,60.0
20190828180000-2112,google;microsoft,adam wright,Ireland,20190828180000,-8.0,53.0
20190307191500-2826,space telescope science institute;university of cambridge institute of astronomy;european space agency gaia;space telescope science institute tony sohn;cnn;wide field infrared survey telescope,laura watkins,"Cambridge, Cambridgeshire, United Kingdom",20190307191500,0.116667,52.2
20190828001500-1345,dover air force;us department of veteran affairs;louis a johnson va medical center;cnn;senate committee on veteran affairs;united states,zachary cohen;ross levitt;joe manchin;felix kirk mcdermott;melanie proctor,"Dover Air Force Base, Delaware, United States;Delaware, United States;United States;West Virginia, United States;Clarksburg, West Virginia, United States",20190828001500,-75.4655,39.128
20191127010000-967,new york times;white house;house budget committee;cnn,donald trump;mark sandy;sara murray;jeremy herb;joe biden;volodymyr zelensky,"New York, United States;United States;Washington, Washington, United States;Ukraine",20191127010000,-74.9384,42.1497
20190412173000-919,psychology at virginia wesleyan university;health at every;netflix;national association for fat acceptance;fat babe pool party,lindy west;aidy bryant;gwyneth paltrow;harriet brown;amanda needham;taryn myers;debby ryan;winston duke;elisabeth moss;mike molly;rosie odonnell;amy schumer;chrissy metz;melissa mccarthy;rebel wilson;lupita nyongo,"New York, United States;Hollywood, California, United States;Australia;Virginia, United States;Jordan",20190412173000,-74.9384,42.1497
20190530173000-2516,national mall tidal basin;national trust for historic preservation;helmut thompson center;cnn;excelsior club;national park service;industrial trust company building;national register of historic;james r thompson center,louis armstrong;los torres;katherine malone;nat king cole,"Bears Ears, Utah, United States;New York, United States;Alabama, United States;Searcy Hospital, Alabama, United States;United States;North Carolina, United States;Texas, United States;Washington, Washington, United States;Rhode Island, United States;Illinois, United States;Charlotte, North Carolina, United States;Puerto Rico;Tonga;National Trust For Historic Preservation, District Of Columbia, United States;Dallas, Texas, United States;North Dakota, United States;Mount Vernon, Alabama, United States;Nashville, Tennessee, United States;France;Chicago, Illinois, United States;Historic District, North Carolina, United States;Utah, United States",20190530173000,-109.868,37.63
20190524210000-529,mass transit authority;cnn,ahmed nasser;andy byford;isaiah thompson,"New York, United States;Manhattan, New York, United States;Brooklyn, New York, United States",20190524210000,-74.9384,42.1497
20190314040000-40,,jayde pearson;faron paul,,20190314040000,,
20190810044500-224,islamic affairs abdullatif bin abdulaziz al-sheikh;international communications;cnn,rashid omar;arabia king salman;king salman;al noor;maryam gul;taj mohammed;eid al-adha;tariq omar;jacinda ardern,"Saudi Arabia;Makkah, Makkah, Saudi Arabia;New Zealand;Singapore",20190810044500,45.0,25.0
20190429233000-1810,union on;department of homeland security;msnbc;defamation league;white house;cnn;office for targeted violence,sarah westwood;kellyanne conway;donald trump;robert e lee;joe biden;sarah sanders;erin perrine;holmes lybrand;yisroel goldstein;john kelly;jonathan greenblatt;kamala harris,"United States;New Zealand;Texas, United States;White House, District Of Columbia, United States;Canada;San Diego, California, United States",20190429233000,-98.5795,39.828175
20190201070000-405,department of education;education welfare service,,"Northern Ireland, Craigavon, United Kingdom",20190201070000,-6.5,54.5
20190329011500-2084,,kevin mcaleenan,,20190329011500,,
20190129143000-2487,netflix;cnn,penn badgley;ted bundy,,20190129143000,,
20190521061500-1147,,brian langstaff;christina mclaughlin;patricia kelly,Ireland;United Kingdom,20190521061500,-8.0,53.0
20190210044500-377,british dietetic association,,United Kingdom,20190210044500,-4.0,54.0
20190312154500-1770,instagram;twitter;gabrielle union,olivia anakwe;gabrielle union;yvette nicole brown,"Hollywood, California, United States;United States;London, London, City Of, United Kingdom",20190312154500,-118.32700000000001,34.0983
20190917170000-519,cambridge university;robinson college;robinson college cambridge,alana cutland,"Massachusetts, United States;Cambridge, Cambridgeshire, United Kingdom;Anjajavy, Mahajanga, Madagascar",20190917170000,-71.5314,42.2373
20191202230000-1012,supreme court;southern poverty law center;justice department;american civil liberties union;united states,richard clifton;william a fletcher;lee gelernt;scott stewart;george w bush;eric miller;bill clinton,Mexico;Canada;United States;Guatemala,20191202230000,-102.0,23.0
20190130213000-337,complutense university of madrid;university of warsaw;hokkaido university;university of british columbia;mcgill university,konrad jankowski;yujiro yamanaka;cristina escribano barreno;aaron fox;stephen harper;stephanie taylor;jaskirat singh sidhu;benjamin perrin;marie manikis;ryan remiorz,"Japan;Poland;Warsaw, (Pl67), Poland;Saskatchewan, Manitoba, Canada;Melfort, Saskatchewan, Canada;California, United States;United Kingdom",20190130213000,138.0,36.0
20190724100000-721,loughborough university;office of the;vinci construction;dubai museum of the;cnn,sergio cavalaro;henrik lund-nielsen;emma reynolds;vincent maillet,"Saudi Arabia;Dubai Museum, Dubayy, United Arab Emirates;Dubai, Dubayy, United Arab Emirates;Denmark;Netherlands;Switzerland",20190724100000,45.0,25.0
20200107194500-983,supreme court;montgomery county circuit court;us supreme court;mississippi supreme court;cnn,jim hood;justice brett kavanaugh;curtis flowers;rob mcduff;joseph loper;adam hopper;lynn fitch;doug evans,"Attala County, Mississippi, United States;United States;Mississippi, United States",20200107194500,-89.59200000000001,33.0571
20190930214500-2169,white house;cnn;united states,scott pelley;donald trump;kevin mccarthy;jim jordan;volodymyr zelensky,"United States;Ohio, United States;Washington, Washington, United States;Ukraine",20190930214500,-98.5795,39.828175
20190926214500-655,supreme court;senate democrats;white house;european union;senate chuck grassley;judiciary committee;national security council,viktor shokin;donald trump;richard durbin;nancy pelosi;joe biden;paul manafort;viktor yanukovych;rudy giuliani;patrick leahy;robert menendez;mike pompeo;steve mnuchin;yuriy lutsenko;chris murphy,"White House, District Of Columbia, United States;South Korea;Ukraine",20190926214500,-77.0364,38.8951
20190531044500-1394,,naomi pallas,,20190531044500,,
20191004191500-1440,rupert news group newspapers;cnn,prince harry,"Sussex, East Sussex, United Kingdom;United Kingdom;London, London, City Of, United Kingdom;Buckingham Palace, Westminster, United Kingdom",20191004191500,-0.083333,50.9167
20190529193000-2008,boeing;ethiopian airline;united airlines;american airlines;lion air;southwest airlines,dennis muilenburg,United States;Ethiopia,20190529193000,-98.5795,39.828175
20191106133000-37,ultras supporters group luca castellini;champions league;twitter;nations league;cnn;russian premier league,kalidou koulibaly;mario balotelli;joao mario;alex thomas;cristiano biraghi;romelu lukaku;hellas verona;cristiano ronaldo,"Milan, Lombardia, Italy;Lisbon, Lisboa, Portugal;Italy;Portugal;Angola;Cagliari, Sardegna, Italy;Russia;France",20191106133000,9.2,45.4667
20190604073000-664,,reese witherspoon;luke jennings;alan sepinwall;rosie knight;phoebe waller;keeley hawes;graham norton;jo berry;anne hathaway,"Hollywood, California, United States;Australia;United States;Russia",20190604073000,-118.32700000000001,34.0983
20190313140000-2283,,,"Lagos, Lagos, Nigeria;Nigeria",20190313140000,3.39583,6.45306
20190716040000-1133,bend police department;bend fraternal order of police;cnn;police department,mirna alsharif;shirley newbill;eric jack logan;scott ruszkowski;pete buttigieg;eric logan,"South Bend, Indiana, United States;India;United States",20190716040000,-86.25,41.6834
20190306230000-2338,youtube;twitter;sony pictures television;cnn;american cancer society,ken jennings kenjennings;ike barinholtz;pat sajak;brad rutter;mike hopkins;alex trebek,United States,20190306230000,-98.5795,39.828175
20190611060000-1162,cnn,los angeles;keith raniere;emilio salinas;marc agnifilo;allison mack;clare bronfman,"Mexico;New York, United States",20190611060000,-102.0,23.0
20190719143000-1419,us embassy;probation office;youtube;twitter;facebook;stockholm district court,fredrik wallin;rakim mayers;daniel suneson;kanye west,"Sweden;United States;Stockholm, Stockholm, Sweden;Kronoberg, Orebro, Sweden",20190719143000,15.0,62.0
20190723140000-891,a northern ireland office,judith thompson;nigel dodds;john penrose,"Northern Ireland, Craigavon, United Kingdom",20190723140000,-6.5,54.5
20190225211500-1818,google;samsung;verizon;netgear;cnn;united states,los angeles;neville ray;las vegas,"New York, United States;United States;North Carolina, United States;Fort Worth, Texas, United States;Missouri, United States;Texas, United States;Washington, Washington, United States;Raleigh, North Carolina, United States;Florida, United States;Canada;San Diego, California, United States;San Antonio, Texas, United States;Oklahoma City, Oklahoma, United States;San Francisco, California, United States;Charlotte, North Carolina, United States;Oklahoma, United States;Phoenix, Arizona, United States;Houston, Texas, United States;Dallas, Texas, United States;Orlando, Florida, United States;Chicago, Illinois, United States",20190225211500,-74.9384,42.1497
20190630181500-172,pride coalition;stonewall national monument;united states,ben hunte,"New York, United States;Portugal;United States;Lisbon, Lisboa, Portugal;Stonewall Inn, New York, United States;Chicago, Illinois, United States;San Francisco, California, United States",20190630181500,-74.9384,42.1497
20190531231500-817,european union;american lung association;cnn;oval office,theresa may;donald trump;nigel farage;meghan markle;larry wilmore;jeremy hunt;michael gove;jeremy corbyn;betsy klein;boris johnson,"United States;United Kingdom;Iran;Sussex, New Brunswick, Canada;White House, District Of Columbia, United States;Ireland;Canada;France",20190531231500,-98.5795,39.828175
20190109101500-716,colman;reuters,joanna lumley;emma stone;stan laurel;olivia colman;queen anne;lizo mzimba;steve coogan;richard e grant;albert hall;christian bale;jason solomons;stan ollie;claire foy;alex bailey;rachel weisz;rami malek,"Hollywood, California, United States;Ireland;Rome, Lazio, Italy;United Kingdom;London, London, City Of, United Kingdom",20190109101500,-118.32700000000001,34.0983
20190519181500-669,white house;cnn;united nations;us embassy to jerusalem,jason greenblatt;benjamin netanyahu;jared kushner,"Jerusalem, Israel (General), Israel;Japan;Manama, Al Manamah, Bahrain;Egypt;West Bank;Israel;Singapore;Washington, Washington, United States;Lebanon;Tel Aviv, Tel Aviv, Israel;Gaza, Israel (General), Israel;Kansas, United States;Poland;Jordan;Bahrain",20190519181500,35.2333,31.7667
20200103110000-356,,david jeffrey;wal lawson;raphael korman;black hawk,"Australia;Melbourne, Victoria, Australia;Mallacoota, Victoria, Australia",20200103110000,135.0,-25.0
20190909100000-40,google;cnn,,"China;Xinjiang, Jiangxi, China;New Delhi, Delhi, India",20190909100000,105.0,35.0
20190419013000-209,international school of analytical psychology in zurich;jung institute of evanston;university of liverpool,jeff benjamin;chung taechun;joni mitchell;kim nam-joon;kim kwangseok;nick cannon;murray stein;jamais vu;carl jung,"Zurich, ZüSz, Switzerland;Illinois, United States;Japan;Kansas, United States;United Kingdom;Greece",20190419013000,8.55,47.3667
20190912123000-1364,,sana sodawala,,20190912123000,,
20190511190000-197,national school safety;university of north carolina at charlotte;security services;cnn;tufts university,riley howell;pete blair;kendrick castillo;kelley petrey,"Texas, United States;Denver, Colorado, United States",20190511190000,-97.6475,31.105999999999998
20190711143000-2021,united kingdom houses of parliament;cnn;carl court getty images europe getty images;united kingdom parliament jessica taylor;united kingdom parliament mark duffy,steve jaggs;charlotte claughton,United Kingdom,20190711143000,-4.0,54.0
20190706153000-778,morgan;us women national soccer team;cnn;united states,michelle akers;jill ellis;megan rapinoe;donald trump;brazilia marta;alex morgan;mark parker;sue bird;samantha mewi,"Germany;Norway;Japan;United States;Thailand;Paris, France (General), France;Netherlands;Argentina;Spain;France;Barcelona, Comunidad Autonoma De Cataluna, Spain",20190706153000,10.5,51.5
20190916190000-45,young;centre for data ethics;royal united services institute rusi alexander babuta;national police;circuit court;associated press,jonathan drake;stonewall jackson;richard moore;robert e lee;heather heyer,United Kingdom,20190916190000,-4.0,54.0
20190610193000-1478,cnn;detergent association;united states,donald trump;meghan markle,"United States;California, United States;Washington, Washington, United States",20190610193000,-98.5795,39.828175
20191112221500-1693,council of canadian academies;world health organization,brett finlay;alexander fleming,"California, United States",20191112221500,-119.74600000000001,36.17
20191101200000-1078,deerfield academy;a boston college;cnn,nicole chavez;kennedy hill;kevin liptak;caroline kelly;robert f kennedy;ethel kennedy;saoirse kennedy hill;courtney kennedy hill,"Mexico;Boston College, Massachusetts, United States;Cape Cod Hospital, Massachusetts, United States;Hyannis Port, Massachusetts, United States;Deerfield Academy, Massachusetts, United States;Massachusetts, United States",20191101200000,-102.0,23.0
20190423230000-539,john regional catholic school in frederick;zaner-bloser national handwriting contest,cathryn hinesley;sara hinesley,"Maryland, United States",20190423230000,-76.7902,39.0724
20190718170000-1711,george washington university hospital,johnny isakson;amanda maddox,"George Washington University Hospital, District Of Columbia, United States;Georgia, United States;Washington, Washington, United States;Georgia",20190718170000,-77.0503,38.9013
20190605003000-1963,american medical collection agency;quest diagnostics,,"New York, United States;United States",20190605003000,-74.9384,42.1497
20191220113000-982,cnn,laura whitmore;caroline flack,"South Africa;Cape Town, Western Cape, South Africa;Ireland;United Kingdom",20191220113000,26.0,-30.0
20190501130000-1173,google;milwaukee state teachers college;mountain college;cnn,ruth asawa;doug criss;ghirardelli square,"Arkansas, United States;California, United States;United States;North Carolina, United States;Black Mountain College, North Carolina, United States;San Francisco, California, United States",20190501130000,-92.3809,34.9513
20190926110000-718,new york times;mattel;twitter;washington post;facebook;cnn,kim culmone,"New York, United States;China;White House, District Of Columbia, United States",20190926110000,-74.9384,42.1497
20190222153000-232,amnesty international;twitter;facebook;young;cnn,ousmane sonko sonkoofficiel;ousmane sonko;idrissa seck;sonkopresident presidentielle;macky sall;khalifa sall;george ajjan;abdou lou;karim wade;mamadou yauck;thomas sankara;abdoulaye wade;zhang xun,"China;Guinea;Qatar;Burkina Faso;Senegal;France;Dakar, Dakar, Senegal",20190222153000,105.0,35.0
