article_id,organizations,persons,locations,timestamp,longitude,latitude
20190203200000-996,cornwall police;facebook;kingsbridge community college;river dart academy;holy trinity church,tyler peck;daniel french,"Malborough, Devon, United Kingdom;Totnes, Devon, United Kingdom;Kingsbridge, Devon, United Kingdom;Salcombe, Devon, United Kingdom",20190203200000,-3.81667,50.2333
20190710103000-869,sterling;office for national statistics,rob kent-smith;ben brettell;hargreaves lansdown;faisal islam,United Kingdom,20190710103000,-4.0,54.0
20181231173000-1754,cnn,martin fayulu;emmanuel ramazani shadary;bukola adebayo;felix tshisekedi;joseph kabila;patrick felix abely,"Lagos, Lagos, Nigeria;Yumbi, Maniema, Democratic Republic Of The Congo;Butembo, Nord-Kivu, Democratic Republic Of The Congo;Nigeria;Democratic Republic Of The Congo;Congo",20181231173000,3.39583,6.45306
20190729194500-592,manchester crown court;high court,justice nicklin;robert thompson;sevdet besim;jon venables;james bulger;mary bell,"Australia;Melbourne, Victoria, Australia;United Kingdom;Manchester, Manchester, United Kingdom",20190729194500,135.0,-25.0
20190726130000-441,supreme court;supreme court justice ruth bader ginsburg;united states,donald trump;justice kavanaugh;brett kavanaugh;justice anthony kennedy;ruth bader ginsburg;neil gorsuch;neil siegel,"United States;White House, District Of Columbia, United States",20190726130000,-98.5795,39.828175
20191220174500-2156,airlines for america;department of homeland security;us office of special counsel;national transportation safety board;cnn;transportation security administration;senate commerce committee;department of homeland security office of inspector,jay brainard;melvin carraway;wolf blitzer;peter goelz;david pekoske;peter v neffenger,"United States;Kansas, United States",20191220174500,-98.5795,39.828175
20190522150000-735,democrats in congress;white house;washington post;house budget committee;cnn,justin amash;donald trump;robert mueller;nancy pelosi;bill clinton;john yarmuth,"United States;Russia;Washington, Washington, United States;Kentucky, United States",20190522150000,-98.5795,39.828175
20190221201500-2129,,nadine labaki,"Norway;Beirut, Beyrouth, Lebanon;Syria",20190221201500,10.0,62.0
20190330004500-731,cnn,eva longoria;bill russo;lucy flores;joe biden,"New York, United States;Nevada, United States;White House, District Of Columbia, United States",20190330004500,-74.9384,42.1497
20190424130000-805,international feature film;sciences board of governors;netflix;cnn;academy of motion picture arts,alfonso cuar;steven spielberg;john bailey,"Rome, Lazio, Italy",20190424130000,12.4833,41.9
20190204204500-1225,wake forest school of medicine;washington university in st;cnn;united states,samuel neal lockhart;sanjay gupta,United States,20190204204500,-98.5795,39.828175
20190927101500-828,,getty imagescopyright;ian wright,United Kingdom,20190927101500,-4.0,54.0
20191120171500-105,israeli air;iran quds,donald trump;benjamin netanyahu;vladimir putin;stefan horngacher;andreas felder;pius paschke;stefan kraft;moritz baer;severin freund;daniel huber;gregor schlierenzauer;constantin schmid;stephan leyhe;richard freitag;karl geiger;markus eisenbichler;michael hayboeck;jan hoerl;philipp aschenwald,"Moscow, Moskva, Russia;United States;Damascus, Dimashq, Syria;Iran;Washington, Washington, United States;Lebanon;China;Yemen;Syria;Russia;Gaza Strip;Iraq;Israel;Tehran, Tehran, Iran;Gaza, Israel (General), Israel;Saudi Arabia;Turkey;Germany;Austria",20191120171500,37.6156,55.7522
20190611160000-271,thomson reuters trust principles;african reserve bank;africa african national congress;moody;united states;reuters;cnn;honda,pravin gordhan;emma rumney;ace magashule;tito mboweni;cyril ramaphosa;alison williams;marc marquez;andrea dovizioso;santi hernandez;david emmett;april moto,"South Africa;Australia;Johannesburg, Gauteng, South Africa;United States;New Zealand;Russia;Turkey;Japan;Spain;London, London, City Of, United Kingdom;Barcelona, Comunidad Autonoma De Cataluna, Spain",20190611160000,26.0,-30.0
20190328220000-1364,boeing;easyjet;british airways;european aviation safety agency,virgin atlantic;howard beckett;thomas cook,United Kingdom,20190328220000,-4.0,54.0
20190424220000-1560,nevada state education association;twitter;cnn;nevada department of education education gift fund,ruben murillo;helen kalla;adam laxalt;las vegas;steve sisolak,"Nevada, United States;Reno, Nevada, United States;United States",20190424220000,-117.12200000000001,38.4199
20190518224500-325,instagram;youtube;cnn;team tati to team james,james charles;jeffree star;james charles-tati westbrook,,20190518224500,,
20200106093000-1111,half of mr park rural fire service;reuters,scott morrison,"Australia;Sydney, New South Wales, Australia;Roger Park, New South Wales, Australia;Yowrie, New South Wales, Australia;Ballyclare, Newtownabbey, United Kingdom;County Antrim, Ballymena, United Kingdom;Ireland;Cobargo, New South Wales, Australia",20200106093000,135.0,-25.0
20190904060000-48,national crime agency,danny shaw;matt horne,"Netherlands;United Kingdom;Felixstowe, Suffolk, United Kingdom;Pakistan",20190904060000,5.75,52.5
20190620161500-2298,arlington national cemetery;us supreme court;american humanist association,justice samuel alito;justice ginsburg;ruth bader ginsburg;sonia sotomayor;justice alito;bladensburg cross,"Peace Cross, Maryland, United States;Maryland, United States;United States",20190620161500,-76.9405,38.9393
20190619174500-1574,national juneteenth observance foundation;us senate;union maj;cnn;united states,abraham lincoln;tom wolf;gordon granger,"Montana, United States;United States;District Of Columbia, United States;South Dakota, United States;Texas, United States;Pennsylvania, United States;North Dakota, United States;Mississippi, United States;Hawaii, United States",20190619174500,-110.32600000000001,46.9048
20191002200000-1998,white house;justice department,donald trump;volodymyr zelensky,"Washington, Washington, United States",20191002200000,-77.0364,38.8951
20190808111500-1187,university of british columbia;cnn;royal canadian mounted police,bryer schmegelsky;len dyck;leonard dyck;elizabeth joseph;kam mcleod;kevin hackett;jane maclatchy;chynna deese;lucas fowler,"Nelson River, Northwest Territories, Canada;Australia;United Kingdom;Canada;North Carolina, United States",20190808111500,-122.46700000000001,71.2
20190322041500-154,cnn,,"Beijing, Beijing, China;Hubei, Guangdong, China;Zaoyang, Hubei, China",20190322041500,116.38799999999999,39.9289
20190208173000-669,facebook;shell,states toyz,,20190208173000,,
20191207173000-84,confederation of british industry;european union;labour party;national insurance;office for national statistics,jo swinson;chuka umunna;sam gyimah,United Kingdom,20191207173000,-4.0,54.0
20191224000000-1296,,ed gonzalez;hcsotexas hcsotexas,"Channelview, Texas, United States;Houston, Texas, United States;Harris County, Texas, United States",20191224000000,-95.1147,29.7761
20191213144500-1260,patrol services rodney harrison;cnn;barnard college,mirna alsharif;lydia pickering;leah beilock;eric levenson;taylor romine;lexi phelan,"Morningside, Virginia, United States;New York, United States;Morningside Park, New York, United States;Waynesboro, Virginia, United States;Virginia, United States;Morningside Heights, New York, United States",20191213144500,-79.9228,37.2607
20191014200000-558,,marty adams;enda mcclafferty;anthony hart;julian smith;brendan mcallister,"Ireland;United Kingdom;Northern Ireland, Craigavon, United Kingdom",20191014200000,-8.0,53.0
20190918034500-909,saudi energy;cnooc;japan petroleum exploration company;cnn;federal reserve;reuters,edward moya;anneken tappe,"China;New York, United States;Saudi Arabia;Japan;Tokyo, Tokyo, Japan;Hong Kong",20190918034500,105.0,35.0
20190117113000-377,strategic defence initiative;congress china;defence intelligence agency;reuters;united states,donald trump;ronald reagan,"China;North Korea;United States;Russia;Alaska, United States",20190117113000,105.0,35.0
20190508221500-2478,budget office;facebook;cnn;rhode island department of education;warwick school committee policy,karen tarasevich;chuck johnston;angelica penta,"Rhode Island, United States;West Warwick, Rhode Island, United States",20190508221500,-71.5101,41.6772
20190817093000-350,rapid support forces,zenab badawi;mohamed hamdan hemeti dagolo;omar al-bashir,"Sudan;River Nile, Nahr An Nil, Sudan;Darfur, Gharb Darfur, Sudan",20190817093000,30.0,16.0
20191121223000-1173,new york times;msnbc;washington post;telemundo;cnn,los angeles,"New York, United States;Washington, Washington, United States",20191121223000,-74.9384,42.1497
20190620114500-1024,,john sudworth,"China;Xinjiang, Jiangxi, China",20190620114500,105.0,35.0
20190314074500-1322,,theresa may;jeremy corbyn,United Kingdom,20190314074500,-4.0,54.0
20190412174500-1074,amnesty international;sweden university of gothenburg;facebook,katie russell;anna blus,"Germany;Netherlands;Arkansas, United States;Spain",20190412174500,10.5,51.5
20190329053000-967,association health plan;us district court;justice department;labor department,john bates;donald trump;josh shapiro,"Pennsylvania, United States;District Of Columbia, United States",20190329053000,-77.264,40.5773
20190626004500-505,nigeria railway corporation;di nigeria police;police mohammed adamu;head of nigeria police on,,Nigeria,20190626004500,8.0,10.0
20190531001500-1676,united kingdom department for international;tissue solutions,laura white;morag mcfarlane,"Bulgaria;Glasgow, Glasgow City, United Kingdom;United Kingdom;Dublin, Dublin, Ireland;Romania",20190531001500,25.0,43.0
20190723150000-2417,,sajid javid,"United Kingdom;Northern Ireland, Craigavon, United Kingdom",20190723150000,-4.0,54.0
20190509023000-1133,cnn,alexandre zurcher;steve maskell,"United Kingdom;New Delhi, Delhi, India;Louisiana, United States;South Africa;Kanyakumari, Tamil Nadu, India;Delhi, Delhi, India;Sri Lanka;Madhya Pradesh, Madhya Pradesh, India;India;Thailand;Taj Mahal, Uttar Pradesh, India;Nepal;Peru;Varanasi, Uttar Pradesh, India;France;Bhutan",20190509023000,-4.0,54.0
20190103184500-875,twitter;cnn;cathay pacific,gary leff,"New York, United States;United States;New Zealand;Vancouver, British Columbia, Canada",20190103184500,-74.9384,42.1497
20191216123000-928,international venice biennale;museum of modern art,marina abramovi;francisco goya;henri rousseau;christian marclay;mark alexander;maurizio cattelan;henri matisse;sarah sze;gina czarnecki;caspar david friedrich;alan kurdi;sean scully;marcel duchamp,"Miami, Florida, United States;New York, United States;United States;United Kingdom;Italy;China;Hollywood, California, United States;Ireland;Syria;Museum Of Modern Art, New York, United States;Belgrade, Serbia (General), ;France;Switzerland;Bahamas, The;Turkey",20191216123000,-80.1937,25.7743
20190904121500-130,beds news agency;st albans crown court,che ambe;tyler stevens;david howard,"Hertfordshire, Hertfordshire, United Kingdom;Abbots Langley, Hertfordshire, United Kingdom",20190904121500,-0.25,51.8333
20190312120000-1058,,daniele nardi;alison hargreaves;tom ballard,"Italy;Belper, Derbyshire, United Kingdom;Nanga Parbat, Northern Areas, Pakistan;Pakistan",20190312120000,12.833333,42.833333
20191216061500-424,boeing;lion air;house transportation committee;aviation administration;ethiopian airlines;cnn,peter defazio;stephen dickson;addis ababa,"Java Sea, Oceans (General), Oceans;Chicago, Illinois, United States;Ethiopia",20191216061500,110.0,-5.0
20190601110000-267,cnn,adrian ballinger;sheena mckenzie;pierre lambert;mount everest;antoine crouin;tete rousse;mont blanc,"Italy;Slovak Republic;Paris, France (General), France;Switzerland;France;London, London, City Of, United Kingdom",20190601110000,12.833333,42.833333
20190527204500-1042,cnn;national rifle association,joan huffman;charles brandon creighton;greg abbott,"Houston, Texas, United States;Texas, United States",20190527204500,-95.3633,29.7633
20190306124500-548,,louis hsieh;tu le,"Beijing, Beijing, China;New York, United States;China;Shanghai, Shanghai, China;Hong Kong",20190306124500,116.38799999999999,39.9289
20190918153000-2048,saudi defense ministry;white house;cnn;united nations;saudi press agency;ekhbariya television;saudi arabia energy;saudi arabia ministry of foreign affairs,javad zarif;hamdi alkhshali;tamara qiblawi;donald trump;hassan rouhani;turki al malki;mike pompeo;salma abdelaziz,"New York, United States;Beirut, Beyrouth, Lebanon;United States;Iraq;Iran;White House, District Of Columbia, United States;Tehran, Tehran, Iran;Yemen;Saudi Arabia;Riyadh, Ar Riya?, Saudi Arabia;Jeddah, Makkah, Saudi Arabia;Kansas, United States;Switzerland;Abqaiq, Ash Sharqiyah, Saudi Arabia",20190918153000,-74.9384,42.1497
20190416011500-1822,revenue service;means committee;cnn,richard neal;donald trump;bernie sanders,"Charlotte, North Carolina, United States;United States;North Carolina, United States;Texas, United States",20190416011500,-80.8431,35.2271
20190227101500-1967,instagram;us air;white house,theresa may;sarah sanders;donald trump,"Vietnam, Republic Of;North Korea;United Kingdom;London, London, City Of, United Kingdom;Washington, Washington, United States",20190227101500,107.83333300000001,16.166667
20190406144500-1431,,ali bouchareb;bruno odos;frank colin;pascal fauret,"Punta Cana, La Altagracia, Dominican Republic;Saint-Tropez, Provence-Alpes-CôD'azur, France;France;Dominican Republic",20190406144500,-68.3656,18.5269
20190603044500-570,new york times;white house;cnn,sarah westwood;donald trump,"Mexico;New York, United States;Australia;Japan;White House, District Of Columbia, United States;China;Canada",20190603044500,-102.0,23.0
20190322120000-925,bloomberg;google;cnn,nana akufo,Nigeria;Pakistan;Ghana,20190322120000,8.0,10.0
20190910121500-464,rhode island department of health;kalamazoo county health community services department;us centers for disease;cnn;michigan health;united states;community services;kalamazoo county health;tufts medical center,rebekah riess;jeremy lechan;james rutherford;conor spielmaker;laurie sylvia,"Central Falls, Rhode Island, United States;United States;Massachusetts, United States;Boston, Massachusetts, United States;Florida, United States;Rhode Island, United States;Michigan, United States;Berrien County, Michigan, United States;Tufts Medical Center, Massachusetts, United States;Connecticut, United States",20190910121500,-71.3923,41.8907
20190429053000-540,democratic senate;white house;members of congress;justice department;cnn;supreme court;house oversight committee;treasury department;house judiciary committee;democratic judiciary committee,chuck schumer;stephen miller;kellyanne conway;donald trump;don mcgahn;jeremy herb;jerrold nadler;nancy pelosi;ted barrett;robert mueller;james clyburn;sara murray;laura jarrett;carl kline;william barr,"United States;Russia;Capitol Hill, District Of Columbia, United States;South Carolina, United States;White House, District Of Columbia, United States",20190429053000,-98.5795,39.828175
20190329134500-1029,time magazine;democratic party;quinnipiac university;cnn,ichabod crane;donald trump;joe crowley;barack obama;nancy pelosi,"New York, United States;Alexandria, Al Iskandariyah, Egypt;Michigan, United States;Massachusetts, United States",20190329134500,-74.9384,42.1497
20191126130000-1768,instagram;american kennel club;cnn,darcy mayo,Germany;United States,20191126130000,10.5,51.5
20190507010000-1078,department of homeland security;immigration services;cnn;us chamber;labor department;department of labor,eli watkins;jamie ehrlich;kirstjen nielsen;neil bradley;kevin mcaleenan,"Florida, United States;United States",20190507010000,-81.717,27.8333
20190606210000-1611,national park service;cnn;mount rainier national park,ruslan khasbulatov;yevgeniy krasnitskiy;kostya constantine toporov,"New York, United States;Portland, Oregon, United States;New Jersey, United States;White River, New York, United States;Mount Rainier, Washington, United States;Oregon, United States;Washington, United States;Liberty Ridge, Washington, United States;Jersey City, New Jersey, United States;Seattle, Washington, United States;Mount Rainier National Park, Washington, United States",20190606210000,-74.9384,42.1497
20190602160000-1460,tottenham hotspur in champions league;champions league,jurgen klopp;harry kane;poch tottenham;virgil van dijk;mauricio pochettino,"Istanbul, Istanbul, Turkey;Kansas, United States;Arkansas, United States;London, London, City Of, United Kingdom;Madrid, Madrid, Spain",20190602160000,28.9647,41.0186
20190908171500-995,police service of northern ireland,sergeant brian reid,"County Fermanagh, Fermanagh, United Kingdom;Northern Ireland, Craigavon, United Kingdom;Maguiresbridge, Fermanagh, United Kingdom",20190908171500,-7.5,54.3333
20191111171500-1026,public prosecution service;european court,theresa may;jeffrey donaldson;aidan mcanespie;daniel hegarty;jayne mccormack;doug beattie;norman smith;ben wallace;joe mccann;jeremy corbyn;simon coveney;john pat cunningham;linda dillon;boris johnson,"Ireland;United Kingdom;Northern Ireland, Craigavon, United Kingdom;Londonderry, Derry, United Kingdom",20191111171500,-8.0,53.0
20191213184500-234,house intelligence committee;white house;trump national security council;national security council;cnn;a national security council,donald trump;alexander vindman;joe biden;keith kellogg;eric brewer;rob blair;mike pompeo;robert obrien;mick mulvaney;mike pence;john bolton;barack obama;george w bush;jennifer williams;kevin liptak;john eisenberg;colin kahl;matt pottinger,"Mexico;Australia;Russia;Washington, Washington, United States;Ukraine",20191213184500,-102.0,23.0
20190827194500-2304,lebanese embassy;harvard university;cnn;united states,lawrence bacow;michael pompeo;ismail ajjawi;jason newton;kevin mcaleenan,United States;Israel;Lebanon,20190827194500,-98.5795,39.828175
20190515224500-712,alabama senate;u s supreme court;supreme court roe v wade;cnn,,"Alabama, United States;United States",20190515224500,-86.8073,32.799
20190122194500-495,government boy higher secondary school;freight transport association;kent county council,heidi skinner;mike whiting,"Trichy, Tamil Nadu, India;Musiri, Tamil Nadu, India;Chennai, Tamil Nadu, India;Manston, Kent, United Kingdom;Dover, Kent, United Kingdom;United Kingdom",20190122194500,78.6856,10.805
20190803001500-567,facebook,ioan buda;alexandru bogdan;viorica dancila;alexandru cumpanasu;alexandra macesanu;gheorghe dinca;ecaterina andronescu;nicolae moga;alexandru cumpanasu facebook;luiza melencu,"Bucharest, Bucuresti, Romania;Romania",20190803001500,26.1,44.4333
20190912153000-2086,cnn,nathan harris;sam whitelock;sam cane;aaron smith;jordie barrett;luke whitelock;codie taylor;ngani laumape;steve hansen;brodie retallick;ben smith;kieran read;joe moody;ryan crotty;scott barrett;rieko ioane;brian odriscoll;beauden barrett;ardie savea;vaea fifita;dane coles;karl tuinukuafe;damian mckenzie;anton lienert-brown;owen franks;liam squire,New Zealand;Ireland;France,20190912153000,174.0,-42.0
20191001031500-1156,university of london;european court,piers morgan;fran unsworth;hanna yusuf;susannah reid;queen mary;lyse doucet;zaynab hussein;sophia smith galer,United Kingdom;Somalia,20191001031500,-4.0,54.0
20191119174500-723,high court,alistair thomson;phil newby;justice irwin,"United Kingdom;London, London, City Of, United Kingdom",20191119174500,-4.0,54.0
20191028050000-1018,cnn,buddhika weerasinghe getty,"Osaka, Osaka, Japan;Japan;Kyoto, Kyoto, Japan;Kamakura, Kanagawa, Japan",20191028050000,135.5,34.6667
20190508003000-385,african national congress;democratic alliance,andrew harding;cyril ramaphosa,South Africa,20190508003000,26.0,-30.0
20190417004500-1377,university of salford;champions league;tottenham champions league;disney;cnn,lee sungmo;bayer leverkusen;simon chadwick;shinji kagawa,"Germany;Vietnam, Republic Of;Hamburg, Hamburg, Germany;Japan;South Korea",20190417004500,10.5,51.5
20190306221500-2283,rider university;winshape foundation;cnn;statement of community,dan cathy;kristine brown;cynthia newman;charley furey;truett cathy,"New Jersey, United States;Rider University, New Jersey, United States",20190306221500,-74.5089,40.314
20190317134500-366,department of homeland security;white house;justice department;national association of immigration judges;human services department;justice team;us government accountability office;national treasury employees union;accenture;office for immigration;accenture federal services;house homeland security committee,alex azar;james mchenry;donald trump;kirstjen nielsen;jeff sessions;john sandweg;rodolfo karisch;tony reardon;john goodman,"Mexico;Phoenix, Arizona, United States;Arizona, United States;United States;Lukeville, Arizona, United States;Washington, Washington, United States",20190317134500,-102.0,23.0
20200101043000-856,united states,donald trump,"United States;Syria;Iraq;Baghdad, Baghdad, Iraq;Iran",20200101043000,-98.5795,39.828175
20200104030000-596,university of reading;university of york;world wide fund for nature;university of sydney,chris dickman;colin beale;tom oliver,"Australia;Sydney, New South Wales, Australia",20200104030000,135.0,-25.0
20190610103000-1227,defense ministry;ministry of defense;misawa air;united states,pacific ocean;akinori hosomi;takeshi iwaya,"Japan;Tokyo, Tokyo, Japan;United States;Russia",20190610103000,138.0,36.0
20190719143000-2363,us navy;us naval forces central;united kingdom navy;united nations;cnn;united states;foreign affairs mohammad javad zarif;iran air;abraham lincoln carrier strike group;us department of defense,javad zarif;donald trump;rand paul;sea hawk;john p murtha;sarah sirgany;fareed zakaria;jason a burns,"Gibraltar;United States;Iraq;United Kingdom;Damascus, Dimashq, Syria;Iran;The White House, District Of Columbia, United States;Tehran, Tehran, Iran;Syria;Gulf Of Oman, Iran (General), Iran;Spain;Bahrain",20190719143000,-5.35,36.133333
20190624183000-1340,cnn,johannes laubach;james masters;atika shubert,"Germany;Hanover, Niedersachsen, Germany;Ahlbach, Rheinland-Pfalz, Germany;Berlin, Berlin, Germany",20190624183000,10.5,51.5
20190304214500-1151,instagram;princeton university;facebook;cnn,donie osullivan;jeremy burge;marty puranik,"New York, United States",20190304214500,-74.9384,42.1497
20190814210000-2019,,,,20190814210000,,
20190619223000-714,national election defense coalition;senate republicans;officers association;senate majority leader mitch mcconnell;senate minority leader chuck schumer;election systems software;cnn,kay stimson;ron wyden;donald trump;kathy rogers;mitch mcconnell;christopher wray;tom burt;susan greenhalgh;maurice turner,"New York, United States;Georgia, United States;United States;South Carolina, United States;Kentucky, United States;Florida, United States;Illinois, United States;Oregon, United States;Russia",20190619223000,-74.9384,42.1497
20190317100000-1092,,donald trump;barack obama;elizabeth warren;joe biden;jo biden;hillary clinton;bernie sanders;kamala harris,"Delaware, United States;Dover, Delaware, United States;Alexandria, Al Iskandariyah, Egypt;Texas, United States",20190317100000,-75.5148,39.3498
20190617093000-331,,jayant shaw;harry houdini;chanchal lahiri,"Hindustan, India (General), India;Kolkata, West Bengal, India;Hooghly River, West Bengal, India",20190617093000,76.0,28.0
20190423014500-1505,united states congress;cnn,donald trump;robert mueller;elizabeth warren;julian castro,"United States;Massachusetts, United States",20190423014500,-98.5795,39.828175
20190420123000-434,united nations,,,20190420123000,,
20191027021500-696,,jane fonda;ted danson,"Hollywood, California, United States;White House, District Of Columbia, United States",20191027021500,-118.32700000000001,34.0983
20190816113000-1705,regulatory agency,nigel mercer;linzy bromfield;zahra nanji,"Chelmsford, Essex, United Kingdom;United Kingdom;Essex, Essex, United Kingdom",20190816113000,0.483333,51.7333
20191017000000-802,instagram;twitter;facebook;disney channel,bella thorne;whoopi goldberg;mickey rourke,"Australia;Beverly Hills, Queensland, Australia;United States",20191017000000,135.0,-25.0
20190528054500-367,carolina law enforcement division;fedex;environmental protection agency;national bar association;university of south florida;tulane university;cnn;united states;tarrant county criminal district attorney office;supreme court justice thurgood marshall;us supreme court;facebook,thurgood marshall;trayvon martin;walter scott;michael drejka;antwon golatte;darran simon;daryl washington;bau tranwhile;oshae terry;michael slager;michele k rayner-goolsby;charley wilkison;amber guyger;bob gualtieri;johnnie cochran;benjamin crump;anthony scott;s lee merritt;botham jean;ron goldman;robert l rogers;judy scott;nicole brown simpson;nouman raja;l chris stewart;corey jones;justin bamberg;roy oliver;braden goyette;john nowak;mark hughes;feidin santana;allison jean,"Louisiana, United States;Georgia, United States;Lumberton, North Carolina, United States;United States;Arlington, Texas, United States;North Carolina, United States;Texas, United States;Atlanta, Georgia, United States;Florida, United States;Pinellas County, Florida, United States;University Of South Florida, Florida, United States;North Charleston, South Carolina, United States;Palm Beach Gardens, Florida, United States;Tarrant County, Texas, United States;Jordan;South Carolina, United States;Balch Springs, Texas, United States;Dallas County, Texas, United States;Clearwater, Florida, United States;Dallas, Texas, United States;Chicago, Illinois, United States",20190528054500,-91.8749,31.1801
20190517143000-146,technavio research;national institutes of health clinical center;department of nutritional sciences at rutgers university;cnn;united states,jesse maida;nurgul fitzgerald;sanjay gupta,"China;United States;Indiana, United States;United Kingdom;Pakistan;Canada",20190517143000,105.0,35.0
